X,Species,Admin,Park_Name,est_suit_area_acre,total_area_acre,perc_suit,Known_Presences,min_dist_miles
357,fountaingrass,NPS,Nicodemus National Historic Site,0,5,0,0,471
358,fountaingrass,NPS,Wupatki National Monument,0,35430,0,0,83
359,fountaingrass,NPS,Washita Battlefield National Historic Site,0,320,0,0,368
360,fountaingrass,NPS,Katahdin Woods And Waters National Monument,0,89564,0,0,640
361,fountaingrass,NPS,Ross Lake National Recreation Area,0,116792,0,0,913
362,fountaingrass,NPS,Petrified Forest National Park,0,222963,0,0,96
363,fountaingrass,NPS,Saratoga National Historical Park,0,3554,0,0,339
364,fountaingrass,NPS,Rocky Mountain National Park,0,267044,0,0,361
365,fountaingrass,NPS,Delaware Water Gap National Recreation Area,0,71041,0,0,173
366,fountaingrass,NPS,Mississippi National River and Recreation Area,0,53831,0,0,827
367,fountaingrass,NPS,Harry S Truman National Historic Site,0,12,0,0,680
368,fountaingrass,NPS,Little Rock Central High School National Historic Site,0,29,0,0,450
369,fountaingrass,NPS,Cedar Breaks National Monument,0,6125,0,0,148
370,fountaingrass,NPS,Fort Monroe National Monument,0,368,0,0,146
371,fountaingrass,NPS,Arches National Park,38,76460,0,0,289
372,fountaingrass,NPS,Fort Laramie National Historic Site,0,897,0,0,518
373,fountaingrass,NPS,Hot Springs National Park,0,5466,0,0,486
374,fountaingrass,NPS,Petroglyph National Monument,0,7202,0,0,8
375,fountaingrass,NPS,President William Jefferson Clinton Birthplace Home National Historic Site,0,1,0,0,464
376,fountaingrass,NPS,Fort Union Trading Post National Historic Site,0,444,0,0,941
377,fountaingrass,NPS,Padre Island National Seashore,568,130558,0,0,13
378,fountaingrass,NPS,Mesa Verde National Park,0,53689,0,0,170
