,Species,Admin,Unit,est_suit_area_acre,total_area_acre,perc_suit,Known_Presences,min_dist_miles
1,ventenata,BLM,Vale District Office,11752704,15222990,0.77,Yes (36),0
2,ventenata,BLM,Medford District Office,2348666,3057476,0.77,Yes (4),0
3,ventenata,BLM,Prineville District Office,9240907,13040676,0.71,Yes (82),0
4,ventenata,BLM,Burns District Office,3977152,5771475,0.69,Yes (14),0
5,ventenata,BLM,Lakeview District Office,5758267,9125689,0.63,Yes (239),0
6,ventenata,BLM,Boise District Office,7661765,12476806,0.61,Yes (7),0
7,ventenata,BLM,Twin Falls District Office,5442466,9049768,0.6,0,40
8,ventenata,BLM,Northern California District,15083210,25799100,0.58,Yes (44),0
9,ventenata,BLM,High Plains District,39442542,70447274,0.56,Yes (5),0
10,ventenata,BLM,Elko District,6879015,12225080,0.56,Yes (6),0
11,ventenata,BLM,Roseburg District Office,1357155,2690213,0.5,0,4
12,ventenata,BLM,Coeur D'alene District Office,6727890,13798609,0.49,Yes (1),0
13,ventenata,BLM,Western Montana District Office,13017961,29542704,0.44,Yes (2),0
14,ventenata,BLM,Spokane District Office,19680759,45535045,0.43,Yes (10),0
15,ventenata,BLM,Nw Oregon District Office,4029330,11107437,0.36,Yes (9),0
16,ventenata,BLM,Northeastern States District Office,168061697,470278322,0.36,0,394
17,ventenata,BLM,Wind River Bighorn Basin District,5745274,16307924,0.35,0,19
18,ventenata,BLM,Idaho Falls District Office,6220152,18237976,0.34,0,14
19,ventenata,BLM,High Desert District,8464960,25349045,0.33,0,25
20,ventenata,BLM,Rocky Mountain District Office,13987613,43012513,0.33,0,246
21,ventenata,BLM,Battle Mountain District,4250472,13487090,0.32,Yes (1),0
22,ventenata,BLM,Winnemucca District,3470372,11321783,0.31,0,1
23,ventenata,BLM,Southeastern States  District Office,98023345,347054542,0.28,0,777
24,ventenata,BLM,North Central Montana District Office,7588537,27943288,0.27,0,61
25,ventenata,BLM,Eastern Montana/Daks District Office,34232592,131224179,0.26,0,12
26,ventenata,BLM,Carson City District,2227781,8943177,0.25,0,28
27,ventenata,BLM,Northwest District Office,2838716,12914979,0.22,0,130
28,ventenata,BLM,West Desert,4658484,22058534,0.21,Yes (9),0
29,ventenata,BLM,Central California District,7604337,44587440,0.17,Yes (3),0
30,ventenata,BLM,Color Country,1938563,13718194,0.14,0,124
31,ventenata,BLM,Ely District,1645788,12876221,0.13,0,25
32,ventenata,BLM,Southwest District Office,879954,10688655,0.08,0,196
33,ventenata,BLM,Farmington District Office,1735447,23359098,0.07,0,359
34,ventenata,BLM,Green River,544836,9229924,0.06,0,72
35,ventenata,BLM,Coos Bay District Office,160395,3066521,0.05,0,14
36,ventenata,BLM,Albuquerque District Office,811049,18192033,0.04,0,455
37,ventenata,BLM,Las Cruces District Office,448300,16040602,0.03,0,616
38,ventenata,BLM,Phoenix District Office,651258,33183750,0.02,0,313
39,ventenata,BLM,Arizona Strip District Office,120889,5049201,0.02,0,237
40,ventenata,BLM,Gila District Office,145156,22174577,0.01,0,446
41,ventenata,BLM,Canyon Country,62996,7441948,0.01,0,174
42,ventenata,BLM,Southern Nevada District,138603,9910954,0.01,0,140
43,ventenata,BLM,California Desert District,228864,32715963,0.01,0,89
44,ventenata,BLM,Grand Staircase Escalante Nat Monument,10054,1881970,0.01,0,257
45,ventenata,BLM,Colorado River District Office,3192,12837842,0,0,283
46,ventenata,BLM,Pecos District Office,59546,20229604,0,0,566
47,ventenata,IPMT,Southeast,53789504,68436190,0.79,0,1001
48,ventenata,IPMT,Mid-Atlantic,24713707,33307472,0.74,0,1247
49,ventenata,IPMT,North Coast/Cascades,39313060,69548751,0.57,Yes (84),0
50,ventenata,IPMT,Heartland,86466581,156900528,0.55,0,406
51,ventenata,IPMT,Northern Great Plains,26342401,62794147,0.42,0,9
52,ventenata,IPMT,National Capital Region,1021627,2953143,0.35,0,1318
53,ventenata,IPMT,Northern Rocky Mountain,63326666,178895171,0.35,Yes (12),0
54,ventenata,IPMT,Northeast,14107829,44544974,0.32,0,1247
55,ventenata,IPMT,California,17152777,68159651,0.25,Yes (27),0
56,ventenata,IPMT,Lake Mead,6180728,87904597,0.07,0,59
57,ventenata,IPMT,Great Lakes,2877216,61766763,0.05,0,526
58,ventenata,IPMT,Southwest,10310342,212434430,0.05,0,243
59,ventenata,IPMT,Southeast Coast,1346799,44612659,0.03,0,1258
60,ventenata,IPMT,Florida/Caribbean,0,37151752,0,0,1328
61,ventenata,IPMT,Gulf Coast,284584,61613355,0,0,1093
62,ventenata,FWS,Sauta Cave National Wildlife Refuge,278,266,1,0,1190
63,ventenata,FWS,Pilot Knob National Wildlife Refuge,105,97,1,0,867
64,ventenata,FWS,Clear Lake National Wildlife Refuge,33695,33579,1,0,17
65,ventenata,FWS,Key Cave National Wildlife Refuge,1061,1053,1,0,1117
66,ventenata,FWS,Tualatin River National Wildlife Refuge,1330,1315,1,0,39
67,ventenata,FWS,Bear Butte National Wildlife Refuge,405,402,1,0,80
68,ventenata,FWS,Fern Cave National Wildlife Refuge,206,203,1,0,1180
69,ventenata,FWS,Nine-pipe National Wildlife Refuge,2094,2082,1,0,6
70,ventenata,FWS,Meredosia National Wildlife Refuge,3740,3699,1,0,776
71,ventenata,FWS,Turnbull National Wildlife Refuge,19286,19213,1,0,7
72,ventenata,FWS,Loess Bluffs National Wildlife Refuge,7624,7562,1,0,569
73,ventenata,FWS,Ankeny National Wildlife Refuge,2827,2804,1,0,7
74,ventenata,FWS,Modoc National Wildlife Refuge,7078,7133,0.99,0,4
75,ventenata,FWS,Presquile National Wildlife Refuge,1279,1297,0.99,0,1460
76,ventenata,FWS,Ozark Cavefish National Wildlife Refuge,41,41,0.99,0,765
77,ventenata,FWS,Karl E. Mundt National Wildlife Refuge,1059,1083,0.98,0,326
78,ventenata,FWS,Muscatatuck National Wildlife Refuge,7706,7832,0.98,0,974
79,ventenata,FWS,National Bison Range,18296,18850,0.97,Yes (1),0
80,ventenata,FWS,Washita National Wildlife Refuge,7907,8114,0.97,0,700
81,ventenata,FWS,Gregory County Waterfowl Production Area,304,314,0.97,0,328
82,ventenata,FWS,Mingo National Wildlife Refuge,21068,21699,0.97,0,912
83,ventenata,FWS,Big Oaks National Wildlife Refuge,49437,51664,0.96,0,1031
84,ventenata,FWS,Middle Mississippi River National Wildlife Refuge,7859,8155,0.96,0,849
85,ventenata,FWS,Mountain Bogs National Wildlife Refuge,34,35,0.96,0,1303
86,ventenata,FWS,Kirwin National Wildlife Refuge,10293,10778,0.96,0,446
87,ventenata,FWS,Lake Isom National Wildlife Refuge,1716,1813,0.95,0,977
88,ventenata,FWS,Ridgefield National Wildlife Refuge,4672,4991,0.94,0,66
89,ventenata,FWS,Wallkill River National Wildlife Refuge,5662,6040,0.94,0,1469
90,ventenata,FWS,Ohio River Islands National Wildlife Refuge,3033,3282,0.92,0,1128
91,ventenata,FWS,Swan River National Wildlife Refuge,1751,1933,0.91,0,41
92,ventenata,FWS,Big Muddy National Fish And Wildlife Refuge,16535,18150,0.91,0,652
93,ventenata,FWS,Two Rivers National Wildlife Refuge,6872,7528,0.91,0,799
94,ventenata,FWS,Baskett Slough National Wildlife Refuge,2269,2516,0.9,0,5
95,ventenata,FWS,Tule Lake National Wildlife Refuge,34067,38908,0.88,0,8
96,ventenata,FWS,Ellicott Slough National Wildlife Refuge,175,198,0.88,0,113
97,ventenata,FWS,Salt Plains National Wildlife Refuge,28185,32144,0.88,0,646
98,ventenata,FWS,Grass Lake National Wildlife Refuge,3515,4051,0.87,0,119
99,ventenata,FWS,Bear Valley National Wildlife Refuge,3613,4223,0.86,0,13
100,ventenata,FWS,Marais Des Cygnes National Wildlife Refuge,6577,7659,0.86,0,680
101,ventenata,FWS,Clarence Cannon National Wildlife Refuge,3215,3736,0.86,0,789
102,ventenata,FWS,Flint Hills National Wildlife Refuge,15768,18575,0.85,0,627
103,ventenata,FWS,Ruby Lake National Wildlife Refuge,34081,39951,0.85,0,42
104,ventenata,FWS,Grays Lake National Wildlife Refuge,4248,4998,0.85,0,97
105,ventenata,FWS,Swan Lake National Wildlife Refuge,9424,11034,0.85,0,672
106,ventenata,FWS,Lower Klamath National Wildlife Refuge,45048,53130,0.85,0,1
107,ventenata,FWS,William L. Finley National Wildlife Refuge,4780,5708,0.84,0,11
108,ventenata,FWS,Lacreek National Wildlife Refuge,14014,16692,0.84,0,188
109,ventenata,FWS,Cherry Valley National Wildlife Refuge,2152,2605,0.83,0,1446
110,ventenata,FWS,Stewart B. Mckinney National Wildlife Refuge,846,1035,0.82,0,1522
111,ventenata,FWS,Mckay Creek National Wildlife Refuge,1498,1827,0.82,0,23
112,ventenata,FWS,Canaan Valley National Wildlife Refuge,13691,16688,0.82,0,1304
113,ventenata,FWS,Lake Andes National Wildlife Refuge,918,1133,0.81,0,323
114,ventenata,FWS,Wheeler National Wildlife Refuge,27351,33884,0.81,0,1157
115,ventenata,FWS,Reelfoot National Wildlife Refuge,8329,10429,0.8,0,971
116,ventenata,FWS,Cross Creeks National Wildlife Refuge,7059,8814,0.8,0,1033
117,ventenata,FWS,Charles Mix County Waterfowl Production Area,3632,4593,0.79,0,325
118,ventenata,FWS,Hutton Lake National Wildlife Refuge,1545,1992,0.78,0,232
119,ventenata,FWS,Sheldon National Wildlife Refuge,452263,577495,0.78,0,16
120,ventenata,FWS,Steigerwald Lake National Wildlife Refuge,867,1116,0.78,0,42
121,ventenata,FWS,Great Swamp National Wildlife Refuge,6048,7946,0.76,0,1487
122,ventenata,FWS,Rocky Flats National Wildlife Refuge,4814,6539,0.74,0,325
123,ventenata,FWS,James River National Wildlife Refuge,3153,4317,0.73,0,1468
124,ventenata,FWS,Bombay Hook National Wildlife Refuge,11122,15386,0.72,0,1479
125,ventenata,FWS,Mountain Longleaf National Wildlife Refuge,6453,9014,0.72,0,1248
126,ventenata,FWS,Bear Lake National Wildlife Refuge,12759,18181,0.7,0,39
127,ventenata,FWS,Rocky Mountain Arsenal National Wildlife Refuge,10713,15992,0.67,0,329
128,ventenata,FWS,Lee Metcalf National Wildlife Refuge,1917,2899,0.66,0,53
129,ventenata,FWS,Logan Cave National Wildlife Refuge,81,126,0.65,0,801
130,ventenata,FWS,Little Pend Oreille National Wildlife Refuge,26891,42230,0.64,0,30
131,ventenata,FWS,Erie National Wildlife Refuge,5650,8853,0.64,0,1208
132,ventenata,FWS,Red Rock Lakes National Wildlife Refuge,39626,63896,0.62,0,202
133,ventenata,FWS,Lake Mason National Wildlife Refuge,6702,11253,0.6,0,141
134,ventenata,FWS,Quivira National Wildlife Refuge,12788,22164,0.58,0,554
135,ventenata,FWS,Bamforth National Wildlife Refuge,676,1171,0.58,0,219
136,ventenata,FWS,Wichita Mountains Wildlife Refuge,33894,59022,0.57,0,766
137,ventenata,FWS,Minidoka National Wildlife Refuge,12222,22525,0.54,0,71
138,ventenata,FWS,Ninigret National Wildlife Refuge,465,883,0.53,0,1604
139,ventenata,FWS,Malheur National Wildlife Refuge,97468,188072,0.52,0,5
140,ventenata,FWS,Patoka River National Wildlife Refuge,5269,10426,0.51,0,956
141,ventenata,FWS,Mortenson Lake National Wildlife Refuge,980,1976,0.5,0,232
142,ventenata,FWS,Cypress Creek National Wildlife Refuge,8662,17389,0.5,0,941
143,ventenata,FWS,Great River National Wildlife Refuge,5964,11834,0.5,0,720
144,ventenata,FWS,Cokeville Meadows National Wildlife Refuge,2926,6286,0.47,0,35
145,ventenata,FWS,Hart Mountain National Antelope Refuge,132953,280286,0.47,0,8
146,ventenata,FWS,Pathfinder National Wildlife Refuge,7859,16851,0.47,0,147
147,ventenata,FWS,Shawangunk Grasslands National Wildlife Refuge,280,598,0.47,0,1481
148,ventenata,FWS,Chickasaw National Wildlife Refuge,12268,26729,0.46,0,985
149,ventenata,FWS,Clarks River National Wildlife Refuge,3814,9392,0.41,0,979
150,ventenata,FWS,Toppenish National Wildlife Refuge,824,2039,0.4,0,57
151,ventenata,FWS,Tennessee National Wildlife Refuge,18933,48141,0.39,0,1025
152,ventenata,FWS,Roanoke River National Wildlife Refuge,6975,21314,0.33,0,1515
153,ventenata,FWS,Emiquon National Wildlife Refuge,846,2631,0.32,0,780
154,ventenata,FWS,Maxwell National Wildlife Refuge,1023,3568,0.29,0,509
155,ventenata,FWS,Sangre De Cristo Conservation Area,45508,166402,0.27,0,424
156,ventenata,FWS,San Pablo Bay National Wildlife Refuge,5281,20224,0.26,0,53
157,ventenata,FWS,Kootenai National Wildlife Refuge,719,2766,0.26,0,44
158,ventenata,FWS,Eastern Neck National Wildlife Refuge,522,2094,0.25,0,1454
159,ventenata,FWS,Great Meadows National Wildlife Refuge,937,3877,0.24,0,1597
160,ventenata,FWS,Sequoyah National Wildlife Refuge,4806,20917,0.23,0,821
161,ventenata,FWS,Crab Orchard National Wildlife Refuge,10559,46265,0.23,0,922
162,ventenata,FWS,Chautauqua National Wildlife Refuge,1464,6635,0.22,0,783
163,ventenata,FWS,Wertheim National Wildlife Refuge,532,2657,0.2,0,1553
164,ventenata,FWS,Ozark Plateau National Wildlife Refuge,853,4300,0.2,0,746
165,ventenata,FWS,Browns Park National Wildlife Refuge,2303,12323,0.19,0,134
166,ventenata,FWS,Bald Knob National Wildlife Refuge,3036,15613,0.19,0,948
167,ventenata,FWS,Columbia National Wildlife Refuge,5276,29287,0.18,0,45
168,ventenata,FWS,Montezuma National Wildlife Refuge,1780,10025,0.18,0,1332
169,ventenata,FWS,Deer Flat National Wildlife Refuge,1958,11623,0.17,0,22
170,ventenata,FWS,Lost Trail National Wildlife Refuge,1459,9017,0.16,0,64
171,ventenata,FWS,Oxbow National Wildlife Refuge,249,1704,0.15,0,1583
172,ventenata,FWS,Deep Fork National Wildlife Refuge,1548,10494,0.15,0,782
173,ventenata,FWS,Rappahannock River Valley National Wildlife Refuge,1452,9532,0.15,0,1436
174,ventenata,FWS,Optima National Wildlife Refuge,621,4341,0.14,0,596
175,ventenata,FWS,Fox River National Wildlife Refuge,141,996,0.14,0,738
176,ventenata,FWS,Great Thicket National Wildlife Refuge,19,144,0.13,0,1509
177,ventenata,FWS,John Hay National Wildlife Refuge,10,80,0.12,0,1549
178,ventenata,FWS,Necedah National Wildlife Refuge,4675,44027,0.11,0,696
179,ventenata,FWS,Edwin B. Forsythe National Wildlife Refuge,4363,43911,0.1,0,1521
180,ventenata,FWS,Bear River Migratory Bird Refuge,7279,76458,0.1,0,9
181,ventenata,FWS,Cape May National Wildlife Refuge,1277,12805,0.1,0,1514
182,ventenata,FWS,Benton Lake National Wildlife Refuge,1186,12343,0.1,0,112
183,ventenata,FWS,Great Dismal Swamp National Wildlife Refuge,9702,113358,0.09,0,1516
184,ventenata,FWS,Featherstone National Wildlife Refuge,31,338,0.09,0,1419
185,ventenata,FWS,Boyer Chute National Wildlife Refuge,309,3968,0.08,0,486
186,ventenata,FWS,Mcnary National Wildlife Refuge,1217,15844,0.08,0,28
187,ventenata,FWS,Wapack National Wildlife Refuge,139,1644,0.08,0,1565
188,ventenata,FWS,Upper Klamath National Wildlife Refuge,2099,25613,0.08,0,24
189,ventenata,FWS,Klamath Marsh National Wildlife Refuge,3316,41869,0.08,0,29
190,ventenata,FWS,Upper Mississippi River National Wildlife and Fish Refuge,14175,189089,0.07,0,609
191,ventenata,FWS,Lower Hatchie National Wildlife Refuge,966,14118,0.07,0,993
192,ventenata,FWS,Martin National Wildlife Refuge,297,4279,0.07,0,1494
193,ventenata,FWS,Umatilla National Wildlife Refuge,1373,23789,0.06,0,50
194,ventenata,FWS,Saddle Mountain National Wildlife Refuge,10511,164309,0.06,0,56
195,ventenata,FWS,Cold Springs National Wildlife Refuge,196,3124,0.06,0,33
196,ventenata,FWS,Petit Manan National Wildlife Refuge,458,7231,0.06,0,1622
197,ventenata,FWS,Hatchie National Wildlife Refuge,707,11426,0.06,0,1021
198,ventenata,FWS,Blackwater National Wildlife Refuge,1852,30463,0.06,0,1445
199,ventenata,FWS,Patuxent Research Refuge,666,12859,0.05,0,1425
200,ventenata,FWS,Fort Niobrara National Wildlife Refuge,875,19093,0.05,0,245
201,ventenata,FWS,Sunkhaze Meadows National Wildlife Refuge,580,11619,0.05,0,1683
202,ventenata,FWS,Franz Lake National Wildlife Refuge,29,583,0.05,0,34
203,ventenata,FWS,National Elk Refuge,1100,24971,0.04,0,143
204,ventenata,FWS,San Juan Islands National Wildlife Refuge,19,456,0.04,0,126
205,ventenata,FWS,Silvio O. Conte National Fish and Wildlife Refuge,1342,38352,0.03,0,1520
206,ventenata,FWS,Sacramento River National Wildlife Refuge,328,11649,0.03,0,29
207,ventenata,FWS,Two Ponds National Wildlife Refuge,2,70,0.03,0,331
208,ventenata,FWS,Camas National Wildlife Refuge,309,10836,0.03,0,154
209,ventenata,FWS,Great Bay National Wildlife Refuge,26,1153,0.02,0,1577
210,ventenata,FWS,Billy Frank Jr. Nisqually National Wildlife Refuge,91,5776,0.02,0,84
211,ventenata,FWS,Baca National Wildlife Refuge,1792,86760,0.02,0,388
212,ventenata,FWS,Grays Harbor National Wildlife Refuge,26,1409,0.02,0,139
213,ventenata,FWS,Valentine National Wildlife Refuge,1495,73686,0.02,0,246
214,ventenata,FWS,Mason Neck National Wildlife Refuge,53,2314,0.02,0,1421
215,ventenata,FWS,Muleshoe National Wildlife Refuge,127,6552,0.02,0,717
216,ventenata,FWS,Seney National Wildlife Refuge,1037,95298,0.01,0,876
217,ventenata,FWS,Holla Bend National Wildlife Refuge,43,6071,0.01,0,903
218,ventenata,FWS,Stillwater National Wildlife Refuge,453,83029,0.01,0,102
219,ventenata,FWS,Desert National Wildlife Range,12126,1636997,0.01,0,194
220,ventenata,FWS,Desoto National Wildlife Refuge,74,8366,0.01,0,481
221,ventenata,FWS,Lewis And Clark National Wildlife Refuge,69,13172,0.01,0,98
222,ventenata,FWS,Union Slough National Wildlife Refuge,0,2908,0,0,524
223,ventenata,FWS,St. Catherine Creek National Wildlife Refuge,0,25428,0,0,1171
224,ventenata,FWS,Whittlesey Creek National Wildlife Refuge,0,359,0,0,668
225,ventenata,FWS,Caddo Lake National Wildlife Refuge,0,8415,0,0,1018
226,ventenata,FWS,Shiawassee National Wildlife Refuge,0,10186,0,0,991
227,ventenata,FWS,Ten Thousand Islands National Wildlife Refuge,0,33944,0,0,1824
228,ventenata,FWS,Passage Key National Wildlife Refuge,0,63,0,0,1695
229,ventenata,FWS,Pahranagat National Wildlife Refuge,0,4672,0,0,194
230,ventenata,FWS,Sullys Hill National Game Preserve,0,1630,0,0,371
231,ventenata,FWS,Willow Lake National Wildlife Refuge,0,1,0,0,384
232,ventenata,FWS,Blue Ridge National Wildlife Refuge,0,906,0,0,103
233,ventenata,FWS,Cedar Island National Wildlife Refuge,0,14328,0,0,1590
234,ventenata,FWS,St. Johns National Wildlife Refuge,0,6460,0,0,1708
235,ventenata,FWS,Black Coulee National Wildlife Refuge,0,683,0,0,269
236,ventenata,FWS,San Luis National Wildlife Refuge,0,17874,0,0,54
237,ventenata,FWS,White Lake National Wildlife Refuge,0,1044,0,0,158
238,ventenata,FWS,Little River National Wildlife Refuge,0,15088,0,0,922
239,ventenata,FWS,Tishomingo National Wildlife Refuge,0,16467,0,0,855
240,ventenata,FWS,Tamarac National Wildlife Refuge,0,43553,0,0,469
241,ventenata,FWS,Chase Lake National Wildlife Refuge,0,4354,0,0,315
242,ventenata,FWS,Marin Islands National Wildlife Refuge,0,469,0,0,70
243,ventenata,FWS,Siletz Bay National Wildlife Refuge,0,525,0,0,35
244,ventenata,FWS,Cahaba River National Wildlife Refuge,0,3619,0,0,1232
245,ventenata,FWS,Bitter Creek National Wildlife Refuge,0,15035,0,0,187
246,ventenata,FWS,San Bernardino National Wildlife Refuge,0,2368,0,0,721
247,ventenata,FWS,Moapa Valley National Wildlife Refuge,0,116,0,0,242
248,ventenata,FWS,Franklin Island National Wildlife Refuge,0,18,0,0,1664
249,ventenata,FWS,Rock Lake National Wildlife Refuge,0,156,0,0,405
250,ventenata,FWS,San Diego Bay National Wildlife Refuge,0,2605,0,0,382
251,ventenata,FWS,Grulla National Wildlife Refuge,0,3239,0,0,700
252,ventenata,FWS,Hackmatack National Wildlife Refuge,0,177,0,0,803
253,ventenata,FWS,Lower Rio Grande Valley National Wildlife Refuge,0,106344,0,0,1280
254,ventenata,FWS,Crocodile Lake National Wildlife Refuge,0,6865,0,0,1910
255,ventenata,FWS,San Diego National Wildlife Refuge,0,12524,0,0,361
256,ventenata,FWS,Cibola National Wildlife Refuge,0,18443,0,0,407
257,ventenata,FWS,Sonny Bono Salton Sea National Wildlife Refuge,0,36906,0,0,376
258,ventenata,FWS,Waccamaw National Wildlife Refuge,0,35040,0,0,1523
259,ventenata,FWS,Harbor Island National Wildlife Refuge,0,711,0,0,988
260,ventenata,FWS,Audubon National Wildlife Refuge,0,14779,0,0,277
261,ventenata,FWS,Harris Neck National Wildlife Refuge,0,2827,0,0,1533
262,ventenata,FWS,Choctaw National Wildlife Refuge,0,3975,0,0,1260
263,ventenata,FWS,Tybee National Wildlife Refuge,0,678,0,0,1527
264,ventenata,FWS,Cape Meares National Wildlife Refuge,0,144,0,0,56
265,ventenata,FWS,Breton National Wildlife Refuge,0,28027,0,0,1339
266,ventenata,FWS,Willapa National Wildlife Refuge,0,16642,0,0,112
267,ventenata,FWS,Nantucket National Wildlife Refuge,0,21,0,0,1680
268,ventenata,FWS,Green Bay National Wildlife Refuge,0,1654,0,0,843
269,ventenata,FWS,Storm Lake National Wildlife Refuge,0,2,0,0,380
270,ventenata,FWS,Florida Panther National Wildlife Refuge,0,26496,0,0,1818
271,ventenata,FWS,Dungeness National Wildlife Refuge,0,1425,0,0,119
272,ventenata,FWS,Three Arch Rocks National Wildlife Refuge,0,15,0,0,55
273,ventenata,FWS,Pea Island National Wildlife Refuge,0,4985,0,0,1593
274,ventenata,FWS,Protection Island National Wildlife Refuge,0,442,0,0,119
275,ventenata,FWS,Agassiz National Wildlife Refuge,0,62273,0,0,491
276,ventenata,FWS,Dale Bumpers White River National Wildlife Refuge,0,158206,0,0,990
277,ventenata,FWS,Okefenokee National Wildlife Refuge,0,416308,0,0,1517
278,ventenata,FWS,Seal Island National Wildlife Refuge,0,122,0,0,1693
279,ventenata,FWS,Imperial National Wildlife Refuge,0,24737,0,0,417
280,ventenata,FWS,Conscience Point National Wildlife Refuge,0,61,0,0,1580
281,ventenata,FWS,Trustom Pond National Wildlife Refuge,0,820,0,0,1608
282,ventenata,FWS,Anahuac National Wildlife Refuge,0,38650,0,0,1203
283,ventenata,FWS,Island Bay National Wildlife Refuge,0,28,0,0,1758
284,ventenata,FWS,Anaho Island National Wildlife Refuge,0,637,0,0,62
285,ventenata,FWS,Hamden Slough National Wildlife Refuge,0,3434,0,0,457
286,ventenata,FWS,Leslie Canyon National Wildlife Refuge,0,25006,0,0,693
287,ventenata,FWS,Port Louisa National Wildlife Refuge,0,17343,0,0,626
288,ventenata,FWS,Stewart Lake National Wildlife Refuge,0,638,0,0,145
289,ventenata,FWS,Wallops Island National Wildlife Refuge,0,372,0,0,1524
290,ventenata,FWS,Cache River National Wildlife Refuge,0,72291,0,0,949
291,ventenata,FWS,Kankakee National Wildlife Refuge And Conservation Area,0,66,0,0,877
292,ventenata,FWS,Sunburst Lake National Wildlife Refuge,0,329,0,0,253
293,ventenata,FWS,Bogue Chitto National Wildlife Refuge,0,36386,0,0,1270
294,ventenata,FWS,Everglades Headwaters National Wildlife Refuge and Conservation Area,0,7025,0,0,1716
295,ventenata,FWS,Nestucca Bay National Wildlife Refuge,0,1194,0,0,38
296,ventenata,FWS,Canfield Lake National Wildlife Refuge,0,4,0,0,285
297,ventenata,FWS,Bill Williams River National Wildlife Refuge,0,5993,0,0,382
298,ventenata,FWS,Lake Nettie National Wildlife Refuge,0,2425,0,0,286
299,ventenata,FWS,Alamosa National Wildlife Refuge,0,12098,0,0,417
300,ventenata,FWS,Merritt Island National Wildlife Refuge,0,135370,0,0,1696
301,ventenata,FWS,Driftless Area National Wildlife Refuge,0,1188,0,0,627
302,ventenata,FWS,Arthur R. Marshall Loxahatchee National Wildlife Refuge,0,145397,0,0,1831
303,ventenata,FWS,Egmont Key National Wildlife Refuge,0,331,0,0,1692
304,ventenata,FWS,Banks Lake National Wildlife Refuge,0,2981,0,0,1490
305,ventenata,FWS,Tensas River National Wildlife Refuge,0,80195,0,0,1117
306,ventenata,FWS,Shell Keys National Wildlife Refuge,0,4,0,0,1288
307,ventenata,FWS,Little Sandy National Wildlife Refuge,0,3820,0,0,995
308,ventenata,FWS,Copalis National Wildlife Refuge,0,26,0,0,151
309,ventenata,FWS,Nomans Land Island National Wildlife Refuge,0,618,0,0,1647
310,ventenata,FWS,Tallahatchie National Wildlife Refuge,0,4187,0,0,1080
311,ventenata,FWS,Crane Meadows National Wildlife Refuge,0,2023,0,0,513
312,ventenata,FWS,Oregon Islands National Wildlife Refuge,0,516,0,0,32
313,ventenata,FWS,San Andres National Wildlife Refuge,0,60090,0,0,688
314,ventenata,FWS,Lostwood National Wildlife Refuge,0,27332,0,0,301
315,ventenata,FWS,Cabeza Prieta National Wildlife Refuge,0,855637,0,0,486
316,ventenata,FWS,Fish Springs National Wildlife Refuge,0,17971,0,0,137
317,ventenata,FWS,Massasoit National Wildlife Refuge,0,208,0,0,1641
318,ventenata,FWS,St. Marks National Wildlife Refuge,0,82181,0,0,1491
319,ventenata,FWS,Archie Carr National Wildlife Refuge,0,255,0,0,1751
320,ventenata,FWS,Des Lacs National Wildlife Refuge,0,14745,0,0,317
321,ventenata,FWS,Mcfaddin National Wildlife Refuge,0,67543,0,0,1205
322,ventenata,FWS,Pierce National Wildlife Refuge,0,391,0,0,31
323,ventenata,FWS,Detroit River International Wildlife Refuge,0,5438,0,0,1047
324,ventenata,FWS,J. Clark Salyer National Wildlife Refuge,0,59328,0,0,347
325,ventenata,FWS,Matlacha Pass National Wildlife Refuge,0,532,0,0,1767
326,ventenata,FWS,Mississippi Sandhill Crane National Wildlife Refuge,0,20155,0,0,1315
327,ventenata,FWS,Bayou Sauvage National Wildlife Refuge,0,25718,0,0,1302
328,ventenata,FWS,Elizabeth Alexandra Morton National Wildlife Refuge,0,178,0,0,1581
329,ventenata,FWS,Farallon Islands National Wildlife Refuge,0,114,0,0,86
330,ventenata,FWS,Minnesota Valley National Wildlife Refuge,0,14937,0,0,524
331,ventenata,FWS,Cross Island National Wildlife Refuge,0,1726,0,0,1748
332,ventenata,FWS,Monomoy National Wildlife Refuge,0,7975,0,0,1677
333,ventenata,FWS,Big Boggy National Wildlife Refuge,0,4500,0,0,1233
334,ventenata,FWS,Gravel Island National Wildlife Refuge,0,19,0,0,842
335,ventenata,FWS,Aroostook National Wildlife Refuge,0,5387,0,0,1692
336,ventenata,FWS,Arrowwood National Wildlife Refuge,0,16008,0,0,346
337,ventenata,FWS,Umbagog National Wildlife Refuge,22,37481,0,0,1571
338,ventenata,FWS,Susquehanna National Wildlife Refuge,0,1,0,0,1447
339,ventenata,FWS,Cedar Point National Wildlife Refuge,0,2598,0,0,1055
340,ventenata,FWS,Kofa National Wildlife Refuge,0,665450,0,0,418
341,ventenata,FWS,Antioch Dunes National Wildlife Refuge,0,53,0,0,80
342,ventenata,FWS,Brazoria National Wildlife Refuge,0,47302,0,0,1218
343,ventenata,FWS,Guadalupe-nipomo Dunes National Wildlife Refuge,0,2501,0,0,186
344,ventenata,FWS,Crescent Lake National Wildlife Refuge,0,45916,0,0,213
345,ventenata,FWS,Attwater Prairie Chicken National Wildlife Refuge,0,10578,0,0,1159
346,ventenata,FWS,North Platte National Wildlife Refuge,0,2920,0,0,181
347,ventenata,FWS,Ernest F. Hollings Ace Basin National Wildlife Refuge,0,12077,0,0,1499
348,ventenata,FWS,Pinellas National Wildlife Refuge,0,392,0,0,1689
349,ventenata,FWS,Dahomey National Wildlife Refuge,0,9794,0,0,1056
350,ventenata,FWS,Wolf Island National Wildlife Refuge,0,4632,0,0,1545
