"","Species","Park_Name","est_suit_area_acre","total_area_acre","perc_suit","Known_Presences","min_dist_miles"
"331","burbuttercup","Mount Rainier National Park",0,236442,0,"0",35
"332","burbuttercup","Hamilton Grange National Memorial",0,2,0,"0",110
"333","burbuttercup","Waco Mammoth National Monument",0,107,0,"0",450
"334","burbuttercup","Tuskegee Institute National Historic Site",0,62,0,"0",631
"335","burbuttercup","Fort Caroline National Memorial",0,140,0,"0",881
"336","burbuttercup","Saint Croix Island International Historic Site",0,7,0,"0",343
"337","burbuttercup","Lower Saint Croix National Scenic Riverway",0,11306,0,"0",259
"338","burbuttercup","Statue Of Liberty National Monument",0,69,0,"0",119
"339","burbuttercup","Natchez Trace Parkway",0,52841,0,"0",373
"340","burbuttercup","Pullman National Monument",0,0,0,"0",229
"341","burbuttercup","Belmont-Paul Women's Equality National Monument",0,0,0,"0",318
"342","burbuttercup","North Cascades National Park",0,501391,0,"0",74
"343","burbuttercup","Stonewall National Monument",0,5,0,"0",116
"344","burbuttercup","Voyageurs National Park",0,204710,0,"0",458
"345","burbuttercup","Congaree National Park",0,26408,0,"0",716
"346","burbuttercup","Federal Hall National Memorial",0,1,0,"0",118
"347","burbuttercup","Lake Chelan National Recreation Area",7,62904,0,"0",61
"348","burbuttercup","Carl Sandburg Home National Historic Site",0,266,0,"0",583
"349","burbuttercup","Lyndon B. Johnson National Historical Park",0,1568,0,"0",533
"350","burbuttercup","Carlsbad Caverns National Park",0,46798,0,"0",278
"351","burbuttercup","Organ Pipe Cactus National Monument",0,330696,0,"0",143
"352","burbuttercup","Crater Lake National Park",2,182555,0,"0",33
"353","burbuttercup","Pictured Rocks National Lakeshore",84,73651,0,"0",523
"354","burbuttercup","Apostle Islands National Lakeshore",0,72778,0,"0",408
"355","burbuttercup","Glacier National Park",1383,1008117,0,"0",208
"356","burbuttercup","Captain John Smith National Historic Trail",0,263,0,"0",390
"357","burbuttercup","New Orleans Jazz National Historical Park",0,5,0,"0",709
"358","burbuttercup","Reconstruction Era National Monument",0,17,0,"0",795
"359","burbuttercup","Freedom Riders National Monument",0,8,0,"0",550
"360","burbuttercup","Birmingham Civil Rights National Monument",0,1,0,"0",534
"361","burbuttercup","Stones River National Battlefield",0,721,0,"0",399
"362","burbuttercup","Big Thicket National Preserve",0,113142,0,"0",555
"363","burbuttercup","Saint Croix National Scenic Riverway",48,69079,0,"0",281
"364","burbuttercup","Rio Grande Wild and Scenic River",0,22060,0,"0",480
"365","burbuttercup","San Antonio Missions National Historical Park",0,943,0,"0",596
"366","burbuttercup","River Raisin National Battlefield Park",0,42,0,"0",424
"367","burbuttercup","Katahdin Woods And Waters National Monument",0,89564,0,"0",336
"368","burbuttercup","Ross Lake National Recreation Area",0,116792,0,"0",93
"369","burbuttercup","Big Bend National Park",0,810893,0,"0",471
"370","burbuttercup","Mississippi National River and Recreation Area",0,53831,0,"0",234
"371","burbuttercup","Little Rock Central High School National Historic Site",0,29,0,"0",359
"372","burbuttercup","Fort Davis National Historic Site",0,518,0,"0",398
"373","burbuttercup","Fort Monroe National Monument",0,368,0,"0",404
"374","burbuttercup","Tumacacori National Historical Park",0,363,0,"0",172
"375","burbuttercup","Hot Springs National Park",0,5466,0,"0",342
"376","burbuttercup","President William Jefferson Clinton Birthplace Home National Historic Site",0,1,0,"0",378
"377","burbuttercup","Padre Island National Seashore",0,130558,0,"0",735
"378","burbuttercup","Indiana Dunes National Lakeshore",55,15931,0,"0",228
