"","Species","Admin","Unit","est_suit_area_acre","total_area_acre","perc_suit","Known_Presences","min_dist_miles"
"1","halogeton","BLM","Southern Nevada District",8448729,9910954,0.85,"0",0
"2","halogeton","BLM","Winnemucca District",9513245,11321783,0.84,"0",0
"3","halogeton","BLM","Carson City District",7363679,8943177,0.82,"0",0
"4","halogeton","BLM","Battle Mountain District",11112461,13487090,0.82,"0",0
"5","halogeton","BLM","Canyon Country",5669983,7441948,0.76,"0",0
"6","halogeton","BLM","Ely District",9028849,12876221,0.7,"0",0
"7","halogeton","BLM","Elko District",8411909,12225080,0.69,"0",0
"8","halogeton","BLM","Twin Falls District Office",6118443,9049768,0.68,"0",0
"9","halogeton","BLM","Burns District Office",3882842,5771475,0.67,"0",0
"10","halogeton","BLM","Grand Staircase Escalante Nat Monument",1199448,1881970,0.64,"0",0
"11","halogeton","BLM","Las Cruces District Office",10172440,16040602,0.63,"0",0
"12","halogeton","BLM","Green River",5834327,9229924,0.63,"0",0
"13","halogeton","BLM","West Desert",12047701,22058534,0.55,"0",0
"14","halogeton","BLM","High Desert District",13932775,25349045,0.55,"0",0
"15","halogeton","BLM","Color Country",7375861,13718194,0.54,"0",0
"16","halogeton","BLM","Wind River Bighorn Basin District",8668143,16307924,0.53,"0",0
"17","halogeton","BLM","Pecos District Office",10705763,20229604,0.53,"0",105
"18","halogeton","BLM","Arizona Strip District Office",2626440,5049201,0.52,"0",0
"19","halogeton","BLM","Phoenix District Office",17088791,33183750,0.51,"0",0
"20","halogeton","BLM","Vale District Office",7452742,15222990,0.49,"0",0
"21","halogeton","BLM","Albuquerque District Office",8756962,18192033,0.48,"0",0
"22","halogeton","BLM","Lakeview District Office",4188184,9125689,0.46,"0",0
"23","halogeton","BLM","North Central Montana District Office",12700667,27943288,0.45,"0",67
"24","halogeton","BLM","Prineville District Office",5706860,13040676,0.44,"0",19
"25","halogeton","BLM","Gila District Office",9030265,22174577,0.41,"0",0
"26","halogeton","BLM","Farmington District Office",9461385,23359098,0.41,"0",0
"27","halogeton","BLM","Rocky Mountain District Office",17058574,43012513,0.4,"0",0
"28","halogeton","BLM","California Desert District",12390714,32715963,0.38,"0",0
"29","halogeton","BLM","Colorado River District Office",4482451,12837842,0.35,"0",5
"30","halogeton","BLM","Boise District Office",4190477,12476806,0.34,"0",0
"31","halogeton","BLM","Idaho Falls District Office",5428159,18237976,0.3,"0",0
"32","halogeton","BLM","Southwest District Office",3250438,10688655,0.3,"0",0
"33","halogeton","BLM","Eastern Montana/Daks District Office",34943039,131224179,0.27,"0",0
"34","halogeton","BLM","Northwest District Office",3390788,12914979,0.26,"0",0
"35","halogeton","BLM","High Plains District",17009753,70447274,0.24,"0",0
"36","halogeton","BLM","Spokane District Office",11084652,45535045,0.24,"0",154
"37","halogeton","BLM","Central California District",9896914,44587440,0.22,"0",0
"38","halogeton","BLM","Western Montana District Office",4292886,29542704,0.15,"0",0
"39","halogeton","BLM","Northern California District",3707294,25799100,0.14,"0",0
"40","halogeton","BLM","Roseburg District Office",0,2690213,0,"0",69
"41","halogeton","BLM","NW Oregon District Office",0,11107437,0,"0",77
"42","halogeton","BLM","Northeastern States District Office",0,470278322,0,"0",251
"43","halogeton","BLM","Coos Bay District Office",0,3066521,0,"0",141
"44","halogeton","BLM","Medford District Office",24,3057476,0,"0",79
"45","halogeton","BLM","Coeur D'alene District Office",37404,13798609,0,"0",50
"46","halogeton","BLM","Southeastern States  District Office",0,347054542,0,"0",407
"47","halogeton","FWS","Pahranagat National Wildlife Refuge",4720,4672,1,"0",0
"48","halogeton","FWS","Umatilla National Wildlife Refuge",24015,23789,1,"0",166
"49","halogeton","FWS","White Lake National Wildlife Refuge",1054,1044,1,"0",39
"50","halogeton","FWS","San Bernardino National Wildlife Refuge",2401,2368,1,"0",112
"51","halogeton","FWS","Moapa Valley National Wildlife Refuge",120,116,1,"0",7
"52","halogeton","FWS","Cold Springs National Wildlife Refuge",3148,3124,1,"0",161
"53","halogeton","FWS","Stewart Lake National Wildlife Refuge",645,638,1,"0",45
"54","halogeton","FWS","Alamosa National Wildlife Refuge",12244,12098,1,"0",0
"55","halogeton","FWS","Minidoka National Wildlife Refuge",22489,22525,1,"0",27
"56","halogeton","FWS","Fish Springs National Wildlife Refuge",18152,17971,1,"0",6
"57","halogeton","FWS","North Platte National Wildlife Refuge",2971,2920,1,"0",125
"58","halogeton","FWS","Mckay Creek National Wildlife Refuge",1845,1827,1,"0",136
"59","halogeton","FWS","Ash Meadows National Wildlife Refuge",24729,24494,1,"0",4
"60","halogeton","FWS","Hailstone National Wildlife Refuge",158,156,1,"0",58
"61","halogeton","FWS","Merced National Wildlife Refuge",3867,3816,1,"0",97
"62","halogeton","FWS","Seedskadee National Wildlife Refuge",26234,25985,1,"0",0
"63","halogeton","FWS","Lake Thibadeau National Wildlife Refuge",24,24,1,"0",229
"64","halogeton","FWS","Benton Lake National Wildlife Refuge",12459,12343,1,"0",175
"65","halogeton","FWS","Pixley National Wildlife Refuge",7452,7476,1,"0",73
"66","halogeton","FWS","Valle De Oro National Wildlife Refuge",498,489,1,"0",59
"67","halogeton","FWS","Bosque Del Apache National Wildlife Refuge",57768,57912,1,"0",113
"68","halogeton","FWS","Ouray National Wildlife Refuge",12042,11914,1,"0",3
"69","halogeton","FWS","Toppenish National Wildlife Refuge",2053,2039,1,"0",202
"70","halogeton","FWS","Camas National Wildlife Refuge",10964,10836,1,"0",8
"71","halogeton","FWS","Fallon National Wildlife Refuge",17781,17955,0.99,"0",11
"72","halogeton","FWS","Bitter Lake National Wildlife Refuge",24526,24861,0.99,"0",211
"73","halogeton","FWS","Sheldon National Wildlife Refuge",565029,577495,0.98,"0",0
"74","halogeton","FWS","Baca National Wildlife Refuge",84412,86760,0.97,"0",0
"75","halogeton","FWS","San Luis National Wildlife Refuge",17134,17874,0.96,"0",105
"76","halogeton","FWS","Stillwater National Wildlife Refuge",79951,83029,0.96,"0",0
"77","halogeton","FWS","Hutton Lake National Wildlife Refuge",1900,1992,0.95,"0",47
"78","halogeton","FWS","Deer Flat National Wildlife Refuge",11050,11623,0.95,"0",9
"79","halogeton","FWS","Sevilleta National Wildlife Refuge",216613,227856,0.95,"0",95
"80","halogeton","FWS","Pathfinder National Wildlife Refuge",15723,16851,0.93,"0",13
"81","halogeton","FWS","Kern National Wildlife Refuge",10305,11242,0.92,"0",91
"82","halogeton","FWS","Bitter Creek National Wildlife Refuge",13739,15035,0.91,"0",64
"83","halogeton","FWS","Saddle Mountain National Wildlife Refuge",148540,164309,0.9,"0",201
"84","halogeton","FWS","Grass Lake National Wildlife Refuge",3599,4051,0.89,"0",51
"85","halogeton","FWS","Desert National Wildlife Range",1450372,1636997,0.89,"0",0
"86","halogeton","FWS","War Horse National Wildlife Refuge",2504,2853,0.88,"0",95
"87","halogeton","FWS","Ul Bend National Wildlife Refuge",50369,56917,0.88,"0",108
"88","halogeton","FWS","Hart Mountain National Antelope Refuge",244877,280286,0.87,"0",2
"89","halogeton","FWS","Rocky Mountain Arsenal National Wildlife Refuge",13717,15992,0.86,"0",75
"90","halogeton","FWS","Mortenson Lake National Wildlife Refuge",1663,1976,0.84,"0",46
"91","halogeton","FWS","Columbia National Wildlife Refuge",24370,29287,0.83,"0",230
"92","halogeton","FWS","Tule Lake National Wildlife Refuge",30437,38908,0.78,"0",63
"93","halogeton","FWS","Bear River Migratory Bird Refuge",57553,76458,0.75,"0",8
"94","halogeton","FWS","Mcnary National Wildlife Refuge",11755,15844,0.74,"0",166
"95","halogeton","FWS","Modoc National Wildlife Refuge",5231,7133,0.73,"0",20
"96","halogeton","FWS","Nine-pipe National Wildlife Refuge",1303,2082,0.63,"0",162
"97","halogeton","FWS","National Bison Range",11645,18850,0.62,"0",153
"98","halogeton","FWS","Leslie Canyon National Wildlife Refuge",13365,25006,0.53,"0",94
"99","halogeton","FWS","Bamforth National Wildlife Refuge",618,1171,0.53,"0",59
"100","halogeton","FWS","Havasu National Wildlife Refuge",17065,39082,0.44,"0",68
"101","halogeton","FWS","Clear Lake National Wildlife Refuge",11870,33579,0.35,"0",47
"102","halogeton","FWS","Medicine Lake National Wildlife Refuge",10169,31502,0.32,"0",111
"103","halogeton","FWS","Lake Mason National Wildlife Refuge",3230,11253,0.29,"0",91
"104","halogeton","FWS","Monte Vista National Wildlife Refuge",4227,14762,0.29,"0",16
"105","halogeton","FWS","Ruby Lake National Wildlife Refuge",10787,39951,0.27,"0",10
"106","halogeton","FWS","San Joaquin River National Wildlife Refuge",3045,11312,0.27,"0",107
"107","halogeton","FWS","Browns Park National Wildlife Refuge",2964,12323,0.24,"0",0
"108","halogeton","FWS","Charles M. Russell National Wildlife Refuge",196640,955297,0.21,"0",96
"109","halogeton","FWS","Cokeville Meadows National Wildlife Refuge",1251,6286,0.2,"0",20
"110","halogeton","FWS","San Andres National Wildlife Refuge",11290,60090,0.19,"0",110
"111","halogeton","FWS","Kofa National Wildlife Refuge",127205,665450,0.19,"0",34
"112","halogeton","FWS","Arapaho National Wildlife Refuge",4785,25866,0.18,"0",0
"113","halogeton","FWS","Cabeza Prieta National Wildlife Refuge",107397,855637,0.13,"0",36
"114","halogeton","FWS","Sacramento National Wildlife Refuge",1251,10917,0.11,"0",115
"115","halogeton","FWS","Crescent Lake National Wildlife Refuge",3309,45916,0.07,"0",139
"116","halogeton","FWS","Sangre De Cristo Conservation Area",12040,166402,0.07,"0",3
"117","halogeton","FWS","Blue Ridge National Wildlife Refuge",58,906,0.06,"0",45
"118","halogeton","FWS","Lower Klamath National Wildlife Refuge",1668,53130,0.03,"0",73
"119","halogeton","FWS","Bear Lake National Wildlife Refuge",288,18181,0.02,"0",29
"120","halogeton","FWS","Silvio O. Conte National Fish and Wildlife Refuge",0,38352,0,"0",1370
"121","halogeton","FWS","Sauta Cave National Wildlife Refuge",0,266,0,"0",880
"122","halogeton","FWS","Union Slough National Wildlife Refuge",0,2908,0,"0",367
"123","halogeton","FWS","St. Catherine Creek National Wildlife Refuge",0,25428,0,"0",732
"124","halogeton","FWS","Whittlesey Creek National Wildlife Refuge",0,359,0,"0",542
"125","halogeton","FWS","Baskett Slough National Wildlife Refuge",0,2516,0,"0",181
"126","halogeton","FWS","Shiawassee National Wildlife Refuge",0,10186,0,"0",840
"127","halogeton","FWS","Pilot Knob National Wildlife Refuge",0,97,0,"0",602
"128","halogeton","FWS","Ten Thousand Islands National Wildlife Refuge",0,33944,0,"0",1425
"129","halogeton","FWS","Passage Key National Wildlife Refuge",0,63,0,"0",1302
"130","halogeton","FWS","Sullys Hill National Game Preserve",0,1630,0,"0",215
"131","halogeton","FWS","Willow Lake National Wildlife Refuge",0,1,0,"0",209
"132","halogeton","FWS","Lake Andes National Wildlife Refuge",0,1133,0,"0",164
"133","halogeton","FWS","Presquile National Wildlife Refuge",0,1297,0,"0",1292
"134","halogeton","FWS","Cedar Island National Wildlife Refuge",0,14328,0,"0",1375
"135","halogeton","FWS","James River National Wildlife Refuge",0,4317,0,"0",1299
"136","halogeton","FWS","Cherry Valley National Wildlife Refuge",0,2605,0,"0",1291
"137","halogeton","FWS","St. Johns National Wildlife Refuge",0,6460,0,"0",1344
"138","halogeton","FWS","Ellicott Slough National Wildlife Refuge",0,198,0,"0",164
"139","halogeton","FWS","Black Coulee National Wildlife Refuge",0,683,0,"0",199
"140","halogeton","FWS","Stewart B. Mckinney National Wildlife Refuge",0,1035,0,"0",1369
"141","halogeton","FWS","Swan River National Wildlife Refuge",0,1933,0,"0",190
"142","halogeton","FWS","Ozark Cavefish National Wildlife Refuge",0,41,0,"0",415
"143","halogeton","FWS","Great Dismal Swamp National Wildlife Refuge",0,113358,0,"0",1337
"144","halogeton","FWS","Little River National Wildlife Refuge",0,15088,0,"0",459
"145","halogeton","FWS","Tishomingo National Wildlife Refuge",0,16467,0,"0",385
"146","halogeton","FWS","Tamarac National Wildlife Refuge",0,43553,0,"0",351
"147","halogeton","FWS","Wichita Mountains Wildlife Refuge",0,59022,0,"0",273
"148","halogeton","FWS","Chase Lake National Wildlife Refuge",0,4354,0,"0",183
"149","halogeton","FWS","Marin Islands National Wildlife Refuge",0,469,0,"0",168
"150","halogeton","FWS","Seney National Wildlife Refuge",0,95298,0,"0",742
"151","halogeton","FWS","Siletz Bay National Wildlife Refuge",0,525,0,"0",205
"152","halogeton","FWS","William L. Finley National Wildlife Refuge",0,5708,0,"0",156
"153","halogeton","FWS","Cahaba River National Wildlife Refuge",0,3619,0,"0",875
"154","halogeton","FWS","Karl E. Mundt National Wildlife Refuge",0,1083,0,"0",167
"155","halogeton","FWS","Reelfoot National Wildlife Refuge",0,10429,0,"0",676
"156","halogeton","FWS","Upper Mississippi River National Wildlife and Fish Refuge",0,189089,0,"0",461
"157","halogeton","FWS","Great Swamp National Wildlife Refuge",0,7946,0,"0",1333
"158","halogeton","FWS","Flint Hills National Wildlife Refuge",0,18575,0,"0",326
"159","halogeton","FWS","Franklin Island National Wildlife Refuge",0,18,0,"0",1520
"160","halogeton","FWS","Lost Trail National Wildlife Refuge",0,9017,0,"0",222
"161","halogeton","FWS","Holla Bend National Wildlife Refuge",0,6071,0,"0",515
"162","halogeton","FWS","Rock Lake National Wildlife Refuge",0,156,0,"0",235
"163","halogeton","FWS","San Diego Bay National Wildlife Refuge",0,2605,0,"0",162
"164","halogeton","FWS","Grulla National Wildlife Refuge",0,3239,0,"0",247
"165","halogeton","FWS","Hackmatack National Wildlife Refuge",0,177,0,"0",646
"166","halogeton","FWS","Lower Rio Grande Valley National Wildlife Refuge",0,106344,0,"0",708
"167","halogeton","FWS","Patuxent Research Refuge",0,12859,0,"0",1268
"168","halogeton","FWS","Crocodile Lake National Wildlife Refuge",0,6865,0,"0",1516
"169","halogeton","FWS","San Diego National Wildlife Refuge",0,12524,0,"0",141
"170","halogeton","FWS","Edwin B. Forsythe National Wildlife Refuge",0,43911,0,"0",1365
"171","halogeton","FWS","Great Bay National Wildlife Refuge",0,1153,0,"0",1431
"172","halogeton","FWS","Cibola National Wildlife Refuge",0,18443,0,"0",86
"173","halogeton","FWS","Sonny Bono Salton Sea National Wildlife Refuge",0,36906,0,"0",135
"174","halogeton","FWS","Waccamaw National Wildlife Refuge",0,35040,0,"0",1259
"175","halogeton","FWS","Bear Valley National Wildlife Refuge",0,4223,0,"0",80
"176","halogeton","FWS","Harbor Island National Wildlife Refuge",0,711,0,"0",851
"177","halogeton","FWS","Audubon National Wildlife Refuge",0,14779,0,"0",113
"178","halogeton","FWS","Harris Neck National Wildlife Refuge",0,2827,0,"0",1211
"179","halogeton","FWS","Choctaw National Wildlife Refuge",0,3975,0,"0",866
"180","halogeton","FWS","Tybee National Wildlife Refuge",0,678,0,"0",1215
"181","halogeton","FWS","Cape Meares National Wildlife Refuge",0,144,0,"0",232
"182","halogeton","FWS","Breton National Wildlife Refuge",0,28027,0,"0",913
"183","halogeton","FWS","Willapa National Wildlife Refuge",0,16642,0,"0",279
"184","halogeton","FWS","Nantucket National Wildlife Refuge",0,21,0,"0",1529
"185","halogeton","FWS","Green Bay National Wildlife Refuge",0,1654,0,"0",702
"186","halogeton","FWS","Storm Lake National Wildlife Refuge",0,2,0,"0",273
"187","halogeton","FWS","Florida Panther National Wildlife Refuge",0,26496,0,"0",1422
"188","halogeton","FWS","Key Cave National Wildlife Refuge",0,1053,0,"0",791
"189","halogeton","FWS","Dungeness National Wildlife Refuge",0,1425,0,"0",369
"190","halogeton","FWS","Little Pend Oreille National Wildlife Refuge",0,42230,0,"0",294
"191","halogeton","FWS","Three Arch Rocks National Wildlife Refuge",0,15,0,"0",232
"192","halogeton","FWS","Red Rock Lakes National Wildlife Refuge",0,63896,0,"0",62
"193","halogeton","FWS","Billy Frank Jr. Nisqually National Wildlife Refuge",0,5776,0,"0",294
"194","halogeton","FWS","Pea Island National Wildlife Refuge",0,4985,0,"0",1401
"195","halogeton","FWS","Protection Island National Wildlife Refuge",0,442,0,"0",375
"196","halogeton","FWS","Agassiz National Wildlife Refuge",0,62273,0,"0",345
"197","halogeton","FWS","Dale Bumpers White River National Wildlife Refuge",0,158206,0,"0",614
"198","halogeton","FWS","Okefenokee National Wildlife Refuge",0,416308,0,"0",1173
"199","halogeton","FWS","Seal Island National Wildlife Refuge",0,122,0,"0",1549
"200","halogeton","FWS","Imperial National Wildlife Refuge",0,24737,0,"0",73
"201","halogeton","FWS","Conscience Point National Wildlife Refuge",0,61,0,"0",1427
"202","halogeton","FWS","Trustom Pond National Wildlife Refuge",0,820,0,"0",1457
"203","halogeton","FWS","Anahuac National Wildlife Refuge",0,38650,0,"0",714
"204","halogeton","FWS","Island Bay National Wildlife Refuge",0,28,0,"0",1362
"205","halogeton","FWS","Anaho Island National Wildlife Refuge",0,637,0,"0",14
"206","halogeton","FWS","Hamden Slough National Wildlife Refuge",0,3434,0,"0",338
"207","halogeton","FWS","Tennessee National Wildlife Refuge",0,48141,0,"0",742
"208","halogeton","FWS","Port Louisa National Wildlife Refuge",0,17343,0,"0",468
"209","halogeton","FWS","Wallops Island National Wildlife Refuge",0,372,0,"0",1366
"210","halogeton","FWS","Cache River National Wildlife Refuge",0,72291,0,"0",598
"211","halogeton","FWS","Kankakee National Wildlife Refuge And Conservation Area",0,66,0,"0",719
"212","halogeton","FWS","Sunburst Lake National Wildlife Refuge",0,329,0,"0",145
"213","halogeton","FWS","Bogue Chitto National Wildlife Refuge",0,36386,0,"0",840
"214","halogeton","FWS","Grays Lake National Wildlife Refuge",0,4998,0,"0",56
"215","halogeton","FWS","Everglades Headwaters National Wildlife Refuge and Conservation Area",0,7025,0,"0",1340
"216","halogeton","FWS","Bombay Hook National Wildlife Refuge",0,15386,0,"0",1322
"217","halogeton","FWS","Nestucca Bay National Wildlife Refuge",0,1194,0,"0",215
"218","halogeton","FWS","Canfield Lake National Wildlife Refuge",0,4,0,"0",140
"219","halogeton","FWS","Bill Williams River National Wildlife Refuge",0,5993,0,"0",101
"220","halogeton","FWS","Fort Niobrara National Wildlife Refuge",0,19093,0,"0",92
"221","halogeton","FWS","Lake Nettie National Wildlife Refuge",0,2425,0,"0",124
"222","halogeton","FWS","Cypress Creek National Wildlife Refuge",0,17389,0,"0",674
"223","halogeton","FWS","Lee Metcalf National Wildlife Refuge",0,2899,0,"0",103
"224","halogeton","FWS","Merritt Island National Wildlife Refuge",0,135370,0,"0",1336
"225","halogeton","FWS","Tualatin River National Wildlife Refuge",0,1315,0,"0",190
"226","halogeton","FWS","Driftless Area National Wildlife Refuge",0,1188,0,"0",473
"227","halogeton","FWS","Arthur R. Marshall Loxahatchee National Wildlife Refuge",0,145397,0,"0",1451
"228","halogeton","FWS","Egmont Key National Wildlife Refuge",0,331,0,"0",1299
"229","halogeton","FWS","Banks Lake National Wildlife Refuge",0,2981,0,"0",1139
"230","halogeton","FWS","Grays Harbor National Wildlife Refuge",0,1409,0,"0",317
"231","halogeton","FWS","Tensas River National Wildlife Refuge",0,80195,0,"0",694
"232","halogeton","FWS","Shell Keys National Wildlife Refuge",0,4,0,"0",823
"233","halogeton","FWS","Little Sandy National Wildlife Refuge",0,3820,0,"0",523
"234","halogeton","FWS","Necedah National Wildlife Refuge",0,44027,0,"0",547
"235","halogeton","FWS","Copalis National Wildlife Refuge",0,26,0,"0",335
"236","halogeton","FWS","Great Thicket National Wildlife Refuge",0,144,0,"0",1357
"237","halogeton","FWS","Nomans Land Island National Wildlife Refuge",0,618,0,"0",1496
"238","halogeton","FWS","Tallahatchie National Wildlife Refuge",0,4187,0,"0",701
"239","halogeton","FWS","Crane Meadows National Wildlife Refuge",0,2023,0,"0",385
"240","halogeton","FWS","Oregon Islands National Wildlife Refuge",0,516,0,"0",180
"241","halogeton","FWS","Lostwood National Wildlife Refuge",0,27332,0,"0",123
"242","halogeton","FWS","Optima National Wildlife Refuge",0,4341,0,"0",89
"243","halogeton","FWS","Massasoit National Wildlife Refuge",0,208,0,"0",1491
"244","halogeton","FWS","Petit Manan National Wildlife Refuge",0,7231,0,"0",1475
"245","halogeton","FWS","Sequoyah National Wildlife Refuge",0,20917,0,"0",406
"246","halogeton","FWS","Boyer Chute National Wildlife Refuge",0,3968,0,"0",329
"247","halogeton","FWS","St. Marks National Wildlife Refuge",0,82181,0,"0",1112
"248","halogeton","FWS","Swan Lake National Wildlife Refuge",0,11034,0,"0",482
"249","halogeton","FWS","Archie Carr National Wildlife Refuge",0,255,0,"0",1384
"250","halogeton","FWS","Des Lacs National Wildlife Refuge",0,14745,0,"0",138
"251","halogeton","FWS","Mcfaddin National Wildlife Refuge",0,67543,0,"0",719
"252","halogeton","FWS","Pierce National Wildlife Refuge",0,391,0,"0",189
"253","halogeton","FWS","Detroit River International Wildlife Refuge",0,5438,0,"0",891
"254","halogeton","FWS","J. Clark Salyer National Wildlife Refuge",0,59328,0,"0",173
"255","halogeton","FWS","Washita National Wildlife Refuge",0,8114,0,"0",211
"256","halogeton","FWS","Matlacha Pass National Wildlife Refuge",0,532,0,"0",1371
"257","halogeton","FWS","Mississippi Sandhill Crane National Wildlife Refuge",0,20155,0,"0",895
"258","halogeton","FWS","Bayou Sauvage National Wildlife Refuge",0,25718,0,"0",865
"259","halogeton","FWS","Elizabeth Alexandra Morton National Wildlife Refuge",0,178,0,"0",1428
"260","halogeton","FWS","Farallon Islands National Wildlife Refuge",0,114,0,"0",199
"261","halogeton","FWS","Minnesota Valley National Wildlife Refuge",0,14937,0,"0",377
"262","halogeton","FWS","Cross Island National Wildlife Refuge",0,1726,0,"0",1607
"263","halogeton","FWS","Sacramento River National Wildlife Refuge",0,11649,0,"0",94
"264","halogeton","FWS","Monomoy National Wildlife Refuge",0,7975,0,"0",1527
"265","halogeton","FWS","Big Boggy National Wildlife Refuge",0,4500,0,"0",731
"266","halogeton","FWS","Gravel Island National Wildlife Refuge",0,19,0,"0",700
"267","halogeton","FWS","Aroostook National Wildlife Refuge",0,5387,0,"0",1559
"268","halogeton","FWS","Sunkhaze Meadows National Wildlife Refuge",0,11619,0,"0",1543
"269","halogeton","FWS","Erie National Wildlife Refuge",0,8853,0,"0",1054
"270","halogeton","FWS","Arrowwood National Wildlife Refuge",0,16008,0,"0",211
"271","halogeton","FWS","Chautauqua National Wildlife Refuge",0,6635,0,"0",625
"272","halogeton","FWS","Mountain Longleaf National Wildlife Refuge",0,9014,0,"0",921
"273","halogeton","FWS","Umbagog National Wildlife Refuge",0,37481,0,"0",1429
"274","halogeton","FWS","Susquehanna National Wildlife Refuge",0,1,0,"0",1291
"275","halogeton","FWS","Cedar Point National Wildlife Refuge",0,2598,0,"0",899
"276","halogeton","FWS","Antioch Dunes National Wildlife Refuge",0,53,0,"0",133
"277","halogeton","FWS","Brazoria National Wildlife Refuge",0,47302,0,"0",722
"278","halogeton","FWS","Guadalupe-nipomo Dunes National Wildlife Refuge",0,2501,0,"0",133
"279","halogeton","FWS","John Hay National Wildlife Refuge",0,80,0,"0",1403
"280","halogeton","FWS","Big Oaks National Wildlife Refuge",0,51664,0,"0",864
"281","halogeton","FWS","National Elk Refuge",0,24971,0,"0",65
"282","halogeton","FWS","Attwater Prairie Chicken National Wildlife Refuge",0,10578,0,"0",657
"283","halogeton","FWS","Ernest F. Hollings Ace Basin National Wildlife Refuge",0,12077,0,"0",1200
"284","halogeton","FWS","Pinellas National Wildlife Refuge",0,392,0,"0",1298
"285","halogeton","FWS","Dahomey National Wildlife Refuge",0,9794,0,"0",664
"286","halogeton","FWS","Featherstone National Wildlife Refuge",0,338,0,"0",1262
"287","halogeton","FWS","San Juan Islands National Wildlife Refuge",0,456,0,"0",388
"288","halogeton","FWS","Wolf Island National Wildlife Refuge",0,4632,0,"0",1218
"289","halogeton","FWS","Quivira National Wildlife Refuge",0,22164,0,"0",194
"290","halogeton","FWS","Nansemond National Wildlife Refuge",0,424,0,"0",1336
"291","halogeton","FWS","Oxbow National Wildlife Refuge",0,1704,0,"0",1434
"292","halogeton","FWS","Flattery Rocks National Wildlife Refuge",0,109,0,"0",401
"293","halogeton","FWS","Conboy Lake National Wildlife Refuge",0,6477,0,"0",201
"294","halogeton","FWS","Delevan National Wildlife Refuge",0,5796,0,"0",118
"295","halogeton","FWS","National Key Deer Refuge",0,83206,0,"0",1486
"296","halogeton","FWS","Kellys Slough National Wildlife Refuge",0,692,0,"0",287
"297","halogeton","FWS","Wertheim National Wildlife Refuge",0,2657,0,"0",1399
"298","halogeton","FWS","Middle Mississippi River National Wildlife Refuge",0,8155,0,"0",614
"299","halogeton","FWS","Logan Cave National Wildlife Refuge",0,126,0,"0",424
"300","halogeton","FWS","Big Lake National Wildlife Refuge",0,10913,0,"0",646
"301","halogeton","FWS","Theodore Roosevelt National Wildlife Refuge",0,6240,0,"0",681
"302","halogeton","FWS","Cedar Keys National Wildlife Refuge",0,928,0,"0",1216
"303","halogeton","FWS","Morgan Brake National Wildlife Refuge",0,7614,0,"0",716
"304","halogeton","FWS","Prime Hook National Wildlife Refuge",0,10157,0,"0",1343
"305","halogeton","FWS","Block Island National Wildlife Refuge",0,129,0,"0",1461
"306","halogeton","FWS","Montezuma National Wildlife Refuge",0,10025,0,"0",1183
"307","halogeton","FWS","Florence Lake National Wildlife Refuge",0,1560,0,"0",146
"308","halogeton","FWS","Creedman Coulee National Wildlife Refuge",0,84,0,"0",244
"309","halogeton","FWS","Waubay National Wildlife Refuge",0,4631,0,"0",241
"310","halogeton","FWS","Chassahowitzka National Wildlife Refuge",0,28345,0,"0",1249
"311","halogeton","FWS","Hopper Mountain National Wildlife Refuge",0,2338,0,"0",43
"312","halogeton","FWS","Pinckney Island National Wildlife Refuge",0,4043,0,"0",1216
"313","halogeton","FWS","Wapack National Wildlife Refuge",0,1644,0,"0",1417
"314","halogeton","FWS","D 'arbonne National Wildlife Refuge",0,17639,0,"0",645
